{
  "brief_id": "brf_example",
  "created_at": "2026-10-17T17:00:00Z",
  "desired_attributes": {
    "colours": [
      "green"
    ],
    "formality": null,
    "free_text": null,
    "garment_keywords": [
      "jacket"
    ],
    "materials": [
      "linen"
    ],
    "style_tags": []
  },
  "disclaimer": "Recorded from GOA demo/scripted briefs. Not a measure of live market demand.",
  "gap_id": "gap_example",
  "merchant_scope": [
    "mer_example"
  ],
  "part_type": "OUTER_LAYER",
  "reason": "NO_MATCHING_PRODUCT",
  "schema_version": "1.0.0",
  "source_type": "SCRIPTED_EVALUATION"
}
